专业家庭式繁殖宠物猫,宠物,宠物店,7.8,7.8,7.8,地铁2号线陆家嘴站
圣玛利亚女校,周边游,景点,6.9,6.9,6.9,长宁路1187号
韩式花艺,生活服务,花店,7.6,7.6,7.6,陆家嘴环路
市中凯旋路停车场,爱车,停车场,0.0,0.0,0.0,凯旋路193号
独一桌,美食,蟹宴,6.9,6.9,6.9,长宁路1277弄中山公寓2号104室
Times golf 体验课活动(教练指导...,运动健身,高尔夫场,0.0,0.0,0.0,陆家嘴名商路
龙之梦影城,电影演出赛事,电影院,0.0,0.0,0.0,长宁路1018号龙之梦购物中心9楼
上海银行atm,生活服务,银行,0.0,0.0,0.0,陆家嘴西路168号卜蜂莲花正大广场B2层
中金国泰控股集团有限公司,购物,家居建材,0.0,0.0,0.0,世纪大道8号国金中心二期6层
神州数码dc·space智慧生活体验...,购物,数码产品,0.0,0.0,0.0,陆家嘴西路168号正大广场
亨达利名表维修中心(正大店),生活服务,居家维修,0.0,0.0,0.0,陆家嘴西路168号
娇韵诗美妍中心(国金中心店),丽人,美容/SPA,7.3,7.4,7.1,世纪大道8号国金中心商场D座LG1-60
瑞贝卡时尚假发(龙之梦购物中心...,购物,化妆品,7.8,7.7,7.6,长宁路1018号龙之梦购物中心2楼
Twinings川宁餐厅,美食,西餐,8.4,9.0,8.7,陆家嘴西路168号正大广场三楼25号
家电制冷维修(宁康小区东南),生活服务,家电维修,0.0,0.0,0.0,长宁路1302弄73支弄2-2
时代金融中心,生活服务,商务楼,0.0,0.0,0.0,银城中路68号
宜家酒店公寓(汇川路店),酒店,经济型,7.4,8.1,7.5,汇川路99号新时空国际商务广场722室
廊亦舫酒楼(正大广场店),美食,本帮江浙菜,7.3,7.6,6.9,陆家嘴西路168号（近东方明珠）正大广场5楼
上海海洋水族馆,周边游,动植物园,6.8,6.8,5.9,陆家嘴环路1388号
天职国际(上海会计师事务所),生活服务,公司企业,0.0,0.0,0.0,丰和路1号港务大厦南楼21层、北楼14层
链家(来福士店),生活服务,房屋地产,0.0,0.0,0.0,长宁路1277弄23号204室、1271号底层和1269号
席融集团,学习培训,升学辅导,0.0,0.0,0.0,陆家嘴街道陆家嘴环路166号未来资产大厦7楼7A
HOLA(长宁龙之梦店),购物,家居建材,7.4,7.6,7.1,长宁路1018号龙之梦购物中心5楼黄中庭
HTC客户服务中心,生活服务,公司企业,0.0,0.0,0.0,路1269-1271号
妙坤翻译有限公司,生活服务,公司企业,0.0,0.0,0.0,汇川路88号
宜家酒店公寓(汇川路店),酒店,公寓式酒店,7.4,8.1,7.5,汇川路99号新时空国际商务广场722室
埋线减肥针灸减肥&韩式定妆眉,丽人,瘦身纤体,9.1,9.1,9.2,万航渡路2088弄
凯欣豪园,生活服务,小区,0.0,0.0,0.0,汇川路88弄
德佑地产(长宁店),生活服务,房屋地产,0.0,0.0,0.0,长宁路1291号
Juice Yoga 孕妇瑜伽(长妇幼店),运动健身,瑜伽,0.0,0.0,0.0,路易·凯旋宫34号2403室
上海贝尔特酒店,酒店,商务酒店,7.7,7.9,7.7,定西路1525号
IMPROVING 启造型(中山公园店),丽人,美发,9.1,9.1,9.1,长宁路988号花园大厦504室
真爱水疗会所,休闲娱乐,更多休闲娱乐,0.0,0.0,0.0,汇川路1250号
美车堂(中山公园店),爱车,汽车美容,0.0,0.0,0.0,长宁路1018号龙之梦购物中心B3楼停车场
进口食品(兆丰广场店),购物,食品茶酒,0.0,0.0,0.0,长宁路1027号兆丰广场B1层
LOUIS VUITTON(上海国金中心旗舰...,购物,服饰鞋包,9.1,9.1,7.8,世纪大道8号国金中心商场D座1楼L1-1商铺
王师傅私房牛肉面(中山公园店),美食,面馆,7.9,7.6,7.6,长宁路999号多媒体广场B1佳吉美食街内
浦发银行(长宁支行营业部),生活服务,银行,0.0,0.0,0.0,长宁路855号
上海宣传画艺术中心,休闲娱乐,文化艺术,0.0,0.0,0.0,陆家嘴9号
PARKWAY HEALTH,医疗健康,其他医疗,6.9,6.9,6.9,世纪大道88号金茂大厦裙楼1楼
茜尔维亚产后修身连锁(中山公园...,丽人,产后塑形,0.0,0.0,0.0,凯旋路166号凯旋坊创意园8幢1楼C座（曹杨 大华 北新泾 静安寺）
胃肠医院,生活服务,公司企业,0.0,0.0,0.0,凯旋路554号
COSTA COFFEE(汇丰银行店),美食,咖啡厅,6.8,7.0,6.8,陆家嘴世纪大道8号上海国金中心汇丰银行大楼
老弄堂上海菜,美食,本帮江浙菜,7.2,7.2,6.9,银城西路
美佳林桑拿保健水磨会所,休闲娱乐,足疗按摩,0.0,0.0,0.0,汇川路99号电联附近
上海太极拳馆(上海太极拳中山公...,运动健身,武术场馆,0.0,0.0,0.0,长宁路855号亨通国际大厦14楼C座
中国瑜伽联盟上海教练总部(长宁...,运动健身,瑜伽,0.0,0.0,0.0,凯旋路166-3号中山公园龙之梦凯旋路大门
兰州牛肉面,美食,面馆,6.7,6.5,6.6,汇川路
家全七福(浦东店),美食,粤菜,8.1,8.3,7.5,富城路33号香格里拉大酒店浦江楼2楼
女人部落(陆家嘴店),丽人,美甲美睫,7.6,7.6,7.6,陆家嘴西路168号正大广场七楼26B号
森茂诊疗所,生活服务,医院,7.6,7.7,7.7,陆家嘴环路1000号恒生银行大厦3楼
美图官方体验店,购物,数码产品,0.0,0.0,0.0,陆家嘴正大广场5楼270号美图专柜
上海小南国(中山公园店),美食,本帮江浙菜,7.4,7.7,7.2,长宁路999号兆丰广场4楼
文斯诺国际艺术创新教育,学习培训,留学,7.6,7.6,7.6,凯旋路166号凯旋坊7幢2楼B1座
Tom Ford(国金中心商场店),购物,服饰鞋包,8.4,8.0,7.1,世纪大道8号国金中心商场2层L2-28
POLO,酒店,更多酒店住宿,0.0,0.0,0.0,陆家嘴西路168号正大广场4楼
曾鉴清律师事务所,生活服务,更多生活服务,0.0,0.0,0.0,长宁路988号花园大厦西楼F、D座12层
金茂87层九重天,美食,咖啡厅,7.7,8.6,8.2,陆家嘴世纪大道88号
宏达游乐场,周边游,景点,6.9,6.7,6.9,长宁路780号中山公园内
虎丸烧肉(玫瑰坊店),美食,烧烤,9.0,8.0,7.9,长宁路890号玫瑰坊2楼
Candy Lab糖果研究室(正大广场一...,购物,食品茶酒,7.6,7.8,7.4,陆家嘴西路168号正大广场6楼
国际金融中心停车场,爱车,停车场,0.0,0.0,0.0,世纪大道8号国金中心商场B1-B2-B3楼
湘味小厨(兆丰广场店),美食,湘菜,0.0,0.0,0.0,长宁路1027号兆丰广场B1层
鸟安(中山公园店),美食,日本菜,7.6,7.1,6.9,汇川路172号
欧尚花坊,生活服务,花店,6.8,6.8,6.8,长宁路1018号龙之梦购物中心B2無印良品对面
匠心宴会,美食,自助餐,7.3,7.3,7.3,凯旋路369号雅仕大厦205室
中山公园高尔夫练习场学习课程,运动健身,高尔夫场,0.0,0.0,0.0,宁康路199号
姚家角警务室,生活服务,政府机构,0.0,0.0,0.0,临近定西路
妙生活水果生鲜超市(中山公园店),购物,水果生鲜,7.7,7.7,7.6,长宁路1301号
GaGa Dance舞蹈会所(中山公园龙...,运动健身,舞蹈,0.0,0.0,0.0,凯旋路200号一楼
龙记香港茶餐厅(龙之梦购物中心...,美食,粤菜,7.2,6.6,6.6,长宁路1018号龙之梦购物中心B1楼
4inlook美目美佳隐形眼镜店(中山...,购物,眼镜店,8.8,9.0,8.7,长宁路1018号龙之梦购物中心2楼蓝中庭SPK14专柜
上海海洋水族馆 停车场,爱车,停车场,0.0,0.0,0.0,陆家嘴环路1388号
四斋蒸鹅心vr体验馆,休闲娱乐,VR,0.0,0.0,0.0,长宁路花园大厦B座5楼
3d打印中心,生活服务,快照/冲印,0.0,0.0,0.0,长宁路888号
知蟹坊(长峰大厦店),美食,蟹宴,7.0,7.0,7.0,定西路1277号长峰大厦2407室
张角,生活服务,小区,0.0,0.0,0.0,汇川路89弄
乐巢酒吧(古北店),休闲娱乐,酒吧,0.0,0.0,0.0,长宁路1027号
北京羲和雅苑烤鸭坊(来福士店),美食,其他,7.6,8.1,7.5,长宁路1123号长宁来福士广场东区6层35号
ZOE's Cafe Bistro 浦东店,周边游,景点,0.0,0.0,0.0,上海浦东新区陆家嘴西路168号正大广场1楼近陆家嘴西路
喜到家酒店公寓(上海中山公园地...,酒店,公寓式酒店,7.0,7.4,7.1,汇川路99号新时空大厦10楼1022室
后Queen line半永久定妆培训学院,学习培训,职业技术,0.0,0.0,0.0,长宁路969号兆丰花园18楼
寰际教育,学习培训,升学辅导,8.4,8.4,8.4,长宁路1189号来福士广场T2座1901单元
火星羽毛球游泳网球篮球乒乓球(...,运动健身,羽毛球馆,0.0,0.0,0.0,长宁路1318号
古意湘味浓(国金中心商场店),美食,湘菜,8.2,7.4,7.6,世纪大道8号国金中心商场LG1-81层
表叔茶餐厅(中山公园店),美食,粤菜,7.2,7.2,6.8,汇川路456号
DW(正大广场店),购物,珠宝饰品,7.9,7.9,7.9,陆家嘴西路168号正大广场2楼
Dolce Gusto 体验店(大时代国金...,购物,食品茶酒,6.6,6.6,6.6,世纪大道8号国际金融中心B2层
春天高端洗浴会所,休闲娱乐,足疗按摩,0.0,0.0,0.0,长宁路739号
天马座花艺(中山公园店),生活服务,花店,7.0,7.0,7.0,定西路1525号
范北社区卫生服务站,医疗健康,医院,0.0,0.0,0.0,凯旋路141号
花园大厦,生活服务,商务楼,0.0,0.0,0.0,长宁路982号花园大厦内
MISSHA(龙之梦购物中心店),丽人,化妆品,6.2,5.9,5.9,长宁路1018号龙之梦购物中心3楼
食天下-喜葵石锅,美食,川菜,7.2,7.0,7.2,陆家嘴环路166号未来资产大厦B1层
SKECHERS(龙之梦购物中心店),购物,运动户外,7.9,7.7,7.3,长宁路1018号龙之梦购物中心5楼
新奢之家·奢侈品护理(正大广场...,生活服务,衣物/皮具洗护,0.0,0.0,0.0,陆家嘴西路168号正大广场西区B1楼FL25A商铺
佳丽宝,生活服务,公司企业,0.0,0.0,0.0,凯旋路369号龙之梦雅仕大厦2层210/212
中国银行24小时自助银行(陆家嘴...,生活服务,银行,0.0,0.0,0.0,陆家嘴西路168号正大广场
卡地亚(国金中心商场店),购物,珠宝饰品,7.7,8.0,5.5,世纪大道8号国金中心商场1层
最.刺青工作室(上海优质老店),丽人,纹身,9.5,9.4,9.5,汇川路99号 新时空国际广场613 （V信satan024）
国太飞行员俱乐部,美食,自助餐,6.9,6.9,6.9,陆家嘴
同道大叔星座咖啡厅 Uncle's Fri...,休闲娱乐,咖啡厅,7.0,8.1,7.5,陆家嘴环路168号正大广场1楼
澳博士高端女性健康管理中心(中...,丽人,产后塑形,9.3,9.3,9.3,长宁路855号亨通国际大厦17C
金载勋跆拳道(贝多芬广场店),运动健身,武术场馆,0.0,0.0,0.0,长宁路1158号贝多芬广场6楼
时代高尔夫入门课程一对一教学,运动健身,高尔夫场,0.0,0.0,0.0,汇川路88号
置美医疗美容诊所,丽人,整形,0.0,0.0,0.0,长宁路1191号长宁来福士广场西区03层02号
上海银行(总行),生活服务,银行,0.0,0.0,0.0,银城中路168号
上海人人乐酒店公寓,酒店,经济型,7.2,7.6,7.5,汇川路99号新时空国际商务广场19楼
Lily韩式半永久嫁接睫毛皮肤管理,丽人,纹绣,8.0,8.0,8.0,汇川路99号2811室
中山公寓,生活服务,小区,0.0,0.0,0.0,长宁路1277弄
永利宝金融信息服务有限公司,爱车,维修保养,0.0,0.0,0.0,陆家嘴花园石桥路66号东亚银行金融大厦1601室
BOSE音响(苏宁电器长宁店),购物,数码产品,7.7,7.4,7.2,长宁路999号苏宁电器2楼
献血屋,医疗健康,其他医疗,6.9,6.9,6.9,东方明珠塔
高尔夫培训班,运动健身,高尔夫场,0.0,0.0,0.0,武夷路
Sakura Beauty日式美甲美睫美业...,丽人,美甲美睫,9.4,9.4,9.4,长宁路982号花园大厦东楼6楼601室
安达曼,美食,东南亚菜,0.0,0.0,0.0,长宁路1139号
La Mer(国金中心商场店),购物,化妆品,8.5,9.0,8.3,世纪大道8号国金中心商场2层
Penta hotel,酒店,更多酒店住宿,6.9,6.7,6.8,定西路1375号
莲SPA足道养生馆(中山公园店),休闲娱乐,足疗按摩,0.0,0.0,0.0,长宁路1055号汇都大楼10层
松下电器(龙之梦购物中心店),生活服务,更多生活服务,0.0,0.0,0.0,长宁路1018号龙之梦购物中心B1楼
来福士停车场,爱车,停车场,0.0,0.0,0.0,长宁路1139
火力全开干锅牛蛙(兆丰广场店),美食,川菜,8.0,7.5,7.9,长宁路1027号兆丰广场B1层
赛乐尔钢琴专卖店,学习培训,音乐培训,0.0,0.0,0.0,陆家嘴
Le Creuset(国金店),购物,家居建材,7.1,6.8,6.7,世纪大道8号上海国金中心LG2楼city'super内
vhvh,生活服务,家政,0.0,0.0,0.0,凯旋路
高尔夫入门课程培训,休闲娱乐,更多休闲娱乐,0.0,0.0,0.0,陆家嘴滨江大道
安园养生(定西路店),休闲娱乐,足疗按摩,0.0,0.0,0.0,定西路1513号1-2
干冰公司,生活服务,公司企业,0.0,0.0,0.0,陆家嘴
Dior(正大广场店),丽人,化妆品,7.4,7.2,7.2,陆家嘴西路168号正大广场1楼
木九十眼镜,购物,眼镜店,6.5,6.8,7.1,长宁路1018号龙之梦购物中心2楼黄中庭
金融城环线,生活服务,交通,0.0,0.0,0.0,滨江大道2450号
MISSHA(龙之梦购物中心店),购物,化妆品,6.2,5.9,5.9,长宁路1018号龙之梦购物中心3楼
十月妈咪(龙之梦购物中心店),购物,亲子购物,0.0,0.0,0.0,长宁路1018号龙之梦购物中心6楼
超右脑教育训练,学习培训,升学辅导,0.0,0.0,0.0,长宁路988号花园大厦西楼B座6层
LOVE&LOVE(龙之梦购物中心店),购物,珠宝饰品,7.1,7.2,7.1,长宁路1018号龙之梦购物中心1楼
玫瑰厅,美食,本帮江浙菜,0.0,0.0,0.0,长宁路1193号长宁来福士东区5楼
基诺浦品牌机能童鞋汇(长宁龙之...,购物,亲子购物,0.0,0.0,0.0,长宁路1018号长宁龙之梦6楼
下田屋物流有限公司(上海事务所),生活服务,物流快递,0.0,0.0,0.0,定西路1279号名光大厦10D
喜到家酒店公寓(上海中山公园地...,酒店,商务酒店,7.0,7.4,7.1,汇川路99号新时空大厦10楼1022室
全家便利店(汇川一店),购物,超市/便利店,7.8,7.7,7.5,汇川路72号
Flair rooftop顶层餐厅酒吧,美食,其他,8.2,9.2,8.8,世纪大道8号上海国金中心丽思卡尔顿酒店58楼
新肴珍宝海鲜(ifc店),美食,东南亚菜,9.1,9.0,8.5,世纪大道8号国金中心L3-10店铺
滩万,美食,日本菜,7.9,8.5,7.7,富城路33号香格里拉大酒店紫金楼2楼
海洋岛,周边游,动植物园,0.0,0.0,0.0,长宁路1289号
Vans(正大广场店),购物,运动户外,7.1,7.1,6.6,陆家嘴西路168号5楼48I
adidas(多媒体店),购物,运动户外,7.0,6.9,6.9,长宁路999号多媒体生活广场1楼
全日空航空公司(上海办事处),生活服务,旅行社,0.0,0.0,0.0,凯旋路369号201室
公厕,生活服务,厕所,0.0,0.0,0.0,世纪大道61号
BEASTS,购物,特色集市,7.1,7.1,7.1,长宁路1018号龙之梦购物中心4楼4099号
点评团,生活服务,网站,0.0,0.0,0.0,安化路492号德必易园创意园C座2楼
美车堂(中山公园店),爱车,洗车,0.0,0.0,0.0,长宁路1018号龙之梦购物中心B3楼停车场
Wagas沃歌斯(龙之梦购物中心店),美食,西餐,8.1,8.3,7.7,长宁路1018号龙之梦购物中心1楼
北虹桥陆家嘴招商处,生活服务,商务楼,0.0,0.0,0.0,花园石桥路39号
YOU MIRA(玫瑰坊),酒店,更多酒店住宿,0.0,0.0,0.0,长宁路890号B2层B2-26B
PANDORA(龙之梦购物中心店),购物,珠宝饰品,8.7,8.4,8.0,长宁路1042号龙之梦购物中心1楼
上海泓朴太极(中山公园馆),运动健身,武术场馆,0.0,0.0,0.0,长宁路888弄15号兆丰嘉园会所B1
正大广场停车库,爱车,停车场,0.0,0.0,0.0,陆家嘴西路168号正大广场内
很高兴遇见你(中山公园龙之梦店),美食,其他,8.0,8.8,8.3,长宁路1018号龙之梦购物中心8楼1018号
弗瑞博撞球会所,休闲娱乐,桌球馆,0.0,0.0,0.0,汇川路450号凯旋坊2楼
健康美甲 MissCandy(正大广场店),丽人,美甲美睫,7.7,7.7,7.7,陆家嘴西路168号05F层73号
花月(兆丰广场店),美食,日本菜,8.1,7.4,7.4,长宁路1027号兆丰广场B1层
奥佳华ogawa(龙之梦购物中心店),购物,家居建材,6.6,6.9,6.9,长宁路1018号龙之梦购物中心5楼
良工巧匠(龙之梦工作室),生活服务,衣物/皮具洗护,0.0,0.0,0.0,长宁路1018号龙之梦办公楼24层2402室
彦诺广告设计制作,生活服务,公司企业,0.0,0.0,0.0,长宁路1055号
奥林巴斯相机,购物,数码产品,0.0,0.0,0.0,长宁路999号苏宁电器1楼
阳光花卉(花花世界),生活服务,花店,0.0,0.0,0.0,汇川路66号
林尚美甲(正大广场店),丽人,美甲美睫,6.8,6.8,6.8,陆家嘴西路100号
上海美怡酒店,酒店,商务酒店,7.1,6.2,6.2,汇川路99号新时空国际商务广场16楼1612室
COVA(国金中心),美食,面包甜点,7.9,7.9,7.6,世纪大道8号国金中心商场L1楼30号商铺
The Beautools(正大广场店),丽人,美容/SPA,9.2,9.2,9.2,陆家嘴西路168号正大广场1F18号
MAO CHANG OPTICAL,购物,眼镜店,0.0,0.0,0.0,陆家嘴西路168号正大广场3楼
SU素原创时尚银饰店(中山公园店),购物,珠宝饰品,7.4,7.3,7.5,长宁路1018号龙之梦购物中心
新华旅行社,生活服务,旅行社,0.0,0.0,0.0,世纪大道88号
Mina DIY 手工坊,休闲娱乐,DIY手工坊,0.0,0.0,0.0,陆家嘴西路168号正大广场7楼中庭
全家便利店(长宁路四店),购物,超市/便利店,7.7,7.7,7.7,长宁路770号
招商银行(长宁支行),生活服务,银行,0.0,0.0,0.0,长宁路1268-1302号
泰妃殿(中山公园龙之梦店),美食,东南亚菜,8.0,8.5,8.1,长宁路1018号龙之梦购物中心5楼
和刺猬一起玩皮,休闲娱乐,DIY手工坊,0.0,0.0,0.0,中山公园5号口出定西路1277号长峰大厦101室
曦辰书院(书法篆刻课堂),学习培训,美术培训,8.5,7.7,8.5,长宁路969号兆丰花园3205
诗泥SPA(正大广场店),丽人,瘦身纤体,9.0,9.0,8.9,陆家嘴西路168号（近东方明珠）正大广场7楼
瑾萱花屋(陆家嘴店),购物,更多购物场所,9.0,9.0,9.1,陆家嘴世纪大道8号上海国金F1
秦淮河畔温泉桑拿会所,休闲娱乐,足疗按摩,0.0,0.0,0.0,长宁路1008号
高和海德公寓,酒店,四星级/高档型,6.9,7.3,7.0,长宁路833号新宁购物中心内
Berrymay健康管理(中山公园店),丽人,瘦身纤体,9.2,9.1,9.1,长宁路855号亨通国际大厦8楼C座
上海人人乐酒店公寓,酒店,三星级/舒适型,7.2,7.6,7.5,汇川路99号新时空国际商务广场19楼
美容院(正大广场店),丽人,整形,0.0,0.0,0.0,陆家嘴西路168号正大广场1楼
怡优美花坊,购物,花店,7.5,7.5,7.5,长宁路1018号
第五空间咖啡馆,休闲娱乐,咖啡厅,7.9,8.3,8.1,长宁路1018号龙之梦购物中心4楼4202室
拯救汽车俱乐部(长宁路店),爱车,维修保养,0.0,0.0,0.0,长宁路988号花园大厦西楼D座3层
名师课堂,学习培训,升学辅导,7.3,7.3,7.3,长宁路花园大厦988号四楼
戴尔电脑专卖店,购物,数码产品,0.0,0.0,0.0,陆家嘴银城中路
全家便利店(正大广场店),购物,超市/便利店,7.8,7.4,7.2,陆家嘴西路168号B1楼21-22室
Mars sporst网球培训中心(中山公...,运动健身,网球场,0.0,0.0,0.0,长宁路1008号
安心旅伴(世纪大道联络点),生活服务,旅行社,0.0,0.0,0.0,世纪大道1号
光头佬面档,美食,面馆,7.6,6.4,7.1,汇川路与凯旋路交汇处东北角
好太太晾衣架维修售后服务中心(...,生活服务,居家维修,0.0,0.0,0.0,长宁路1168号
上海迪士尼旗舰店,购物,服饰鞋包,9.0,9.1,9.1,丰和路180号
Agnes Sport b,购物,运动户外,7.5,7.5,7.4,世纪大道8號上海國金中心商場地下二層LG2-16
SEPHORA(正大广场店),丽人,化妆品,6.7,6.5,6.0,陆家嘴西路168号（近东方明珠）正大广场1楼
美车堂(正大广场B3店),爱车,汽车美容,0.0,0.0,0.0,陆家嘴西路168号正大广场B3层B301
贝斯广告制作(长宁店),生活服务,快照/冲印,0.0,0.0,0.0,长宁路
千姿花卉(中山公园店),购物,花店,0.0,0.0,0.0,凯旋路369号5楼
浦东香阁里拉,美食,海鲜,6.9,6.9,6.9,陆家嘴
怡优美花坊,购物,更多购物场所,7.5,7.5,7.5,长宁路1018号
PizzaExpress马上诺(中山公园店),美食,西餐,8.8,9.1,8.8,长宁路1018号龙之梦购物中心7楼蓝中庭
上海海洋水族馆餐厅(水族馆餐厅...,美食,小吃快餐,6.8,6.8,6.8,陆家嘴环路1388号1楼
贝多芬广场a座,生活服务,商务楼,0.0,0.0,0.0,长宁路1158号
欧尚花坊,购物,花店,6.8,6.8,6.8,长宁路1018号龙之梦购物中心B2無印良品对面
foreo(正大广场店),购物,化妆品,6.5,6.4,6.3,陆家嘴西路168号（近东方明珠）正大广场1楼
彩花束(陆家嘴西路正大广场店),购物,更多购物场所,9.3,9.3,9.3,陆家嘴西路168号正大广场B2楼超市中门入口右侧
木九十(浦东正大店),购物,眼镜店,7.0,7.1,6.6,陆家嘴西路168号正大广场3楼
博彩图文数码快印,生活服务,快照/冲印,0.0,0.0,0.0,凯旋路
浏蒸记浏阳蒸菜,美食,湘菜,7.3,7.3,7.3,长宁路999号地下二层
广融达金融租赁有限公司,爱车,汽车租赁,0.0,0.0,0.0,世纪大道88号金茂大厦47层
汉堡王(上海正大店),美食,小吃快餐,7.3,7.2,7.0,陆家嘴西路168号正大广场5楼32室
利苑(国金中心店),美食,粤菜,8.2,8.4,7.6,世纪大道8号上海国金中心3楼L3-17&18
博邦地产,生活服务,房屋地产,0.0,0.0,0.0,长宁路855号亨通国际大厦5层
古巷佳苑,周边游,景点,0.0,0.0,0.0,古堰画乡堰头村39号
优帕克服务式公寓(圣约翰名邸店),酒店,经济型,0.0,0.0,0.0,长宁路1188弄
babyjump少儿舞蹈,运动健身,舞蹈,0.0,0.0,0.0,凯旋路200号
三巡海南鸡饭(正大广场店),美食,东南亚菜,7.3,7.1,7.1,陆家嘴西路168号（近东方明珠）正大广场B2楼
上航旅游(定西路店),生活服务,旅行社,0.0,0.0,0.0,定西路1279号名光大厦1403D座
牛卡vr,休闲娱乐,VR,0.0,0.0,0.0,陆家嘴西路168号正大广场8层
cici纤美(长宁来福士店),丽人,瘦身纤体,7.7,7.7,7.7,长宁路1139号长宁来福士广场西区3楼
Hi味花甲(中山公园龙之梦店),美食,小吃快餐,8.3,7.4,8.1,长宁路1018号龙之梦购物中心B2楼
时代高尔夫练习场教学中心,运动健身,高尔夫场,0.0,0.0,0.0,凯旋路317号
瑞贝卡时尚假发(龙之梦购物中心...,丽人,化妆品,7.8,7.7,7.6,长宁路1018号龙之梦购物中心2楼
耶里夏丽(正大广场店),美食,新疆菜,9.0,9.0,8.5,陆家嘴西路168号（近东方明珠）正大广场2楼
上海浦东丽思卡尔顿酒店,酒店,五星级/豪华型,9.3,9.2,9.1,陆家嘴世纪大道8号国金中心
Pret A Manger(上海国金中心店),美食,西餐,8.7,9.1,9.0,世纪大道8号上海国金中心LG1－37
哈根达斯(龙之梦店),美食,咖啡厅,7.2,7.0,7.0,长宁路1018号龙之梦购物中心1071商铺
caferica,购物,家居建材,0.0,0.0,0.0,陆家嘴西路168号正大广场B2层
一米辅导(中山公园中心),学习培训,升学辅导,7.7,7.7,7.7,长宁路1018号
双线皮具私人定制,休闲娱乐,DIY手工坊,0.0,0.0,0.0,长宁路890号2楼26。玫瑰坊观光电梯二楼开门就是
莲SPA足道养生馆(中山公园店),休闲娱乐,中医养生,0.0,0.0,0.0,长宁路1055号汇都大楼10层
NOBLE(正大广场),生活服务,花店,0.0,0.0,0.0,陆家嘴西路168号B2层
三只小鸡,美食,韩国料理,0.0,0.0,0.0,长宁路1018号龙之梦B2层
diptyque(国金中心店),购物,化妆品,7.8,7.8,7.8,上海ifc国金中心地下二层1010APOTHECARY
星巴克(正大2店),美食,咖啡厅,7.2,7.0,7.0,陆家嘴西路168号1F
上海人家花样年华(长宁店),美食,本帮江浙菜,7.7,7.9,7.3,长宁路1018号龙之梦购物中心8楼
链家(凯欣店),生活服务,房屋地产,0.0,0.0,0.0,上海市长宁区汇川路86号
艺老爷摄影工作室,生活服务,更多生活服务,0.0,0.0,0.0,世纪大道6号
九龙冰室茶餐厅(中山公园店),美食,粤菜,6.9,7.0,6.7,长宁路1018号龙之梦购物中心2楼2429号铺
全家便利店(银城中路店),购物,食品茶酒,7.5,7.4,7.5,银城中路8号1楼
上海君众搬家搬场公司,生活服务,搬家,0.0,0.0,0.0,全市上门服务
kangertech蒸汽电子烟(长宁来福...,购物,数码产品,8.1,8.1,8.1,长宁路1191号来福士西区二楼电梯口
原汁缘味过桥米线(正大广场店),美食,小吃快餐,7.1,7.2,6.9,陆家嘴西路168号正大广场B2层
艺高文化工作室,学习培训,美术培训,0.0,0.0,0.0,定西路2077号金桥大夏2001室
真艾堂中医艾灸馆,休闲娱乐,中医养生,0.0,0.0,0.0,定西路1279号名光大厦2105室
瑞贝卡时尚假发,丽人,美发,7.5,7.4,7.4,陆家嘴西路168号正大广场3楼
朝日日语(中山公园中心),学习培训,兴趣生活,9.1,9.1,9.0,长宁路855号亨通国际大厦18楼
猫家美甲美睫纹绣沙龙,丽人,美甲美睫,9.2,9.2,9.3,汇川路99号新时空广场5楼502室
HITOMI OPTICIAN美瞳(正大广场店...,购物,眼镜店,8.7,8.7,8.7,陆家嘴西路168号正大广场5楼
贝尔特酒店-洗手间,生活服务,厕所,0.0,0.0,0.0,定西路1525号贝尔特酒店
白小仓库,医疗健康,其他医疗,0.0,0.0,0.0,长宁路986号国美电器2楼
梵创造型(中山公园店),丽人,美发,9.4,9.4,9.4,汇川路76号1楼
happyfish,美食,海鲜,7.0,7.0,7.0,长宁路1030号
truelove挚爱鲜花,生活服务,花店,0.0,0.0,0.0,陆家嘴环路1333号（(近东方明珠)）
百花阁娱乐中心,休闲娱乐,足疗按摩,0.0,0.0,0.0,陆家嘴银城中路
Onitsuka Tiger,购物,运动户外,0.0,0.0,0.0,长宁路1139号长宁来福士5楼
Yusen Logistics,生活服务,物流快递,0.0,0.0,0.0,凯旋路369号龙之梦雅仕大厦
心飞悦个人形象设计(中山公园店),学习培训,职业技术,0.0,0.0,0.0,汇川路76号龙之梦商业广场24楼
交银金融大厦,生活服务,商务楼,0.0,0.0,0.0,银城中路190号
高尔夫3998入门课程教练教学,运动健身,高尔夫场,0.0,0.0,0.0,汇川路
必胜客(玫瑰坊店),美食,西餐,8.1,8.4,7.9,长宁路890号玫瑰坊1楼101，靠近中山公园
克拉克-东南亚餐厅,美食,东南亚菜,0.0,0.0,0.0,莘庄龙之梦B2
Luz solar beauty日系美容脱毛日...,丽人,美容/SPA,9.0,9.0,9.1,汇川路99号新时空国际商务广场1101室
星怡会(龙之梦购物中心店),美食,东南亚菜,8.3,8.5,8.2,长宁路1018号龙之梦购物中心7楼
人马线全国连锁健身工作室(中山...,运动健身,健身中心,0.0,0.0,0.0,长宁路988号花园大厦10楼D室
全日空(南京西路分部),生活服务,公司企业,0.0,0.0,0.0,凯旋路369号龙之梦雅仕大厦201室
XOXO(龙之梦购物中心店),购物,亲子购物,0.0,0.0,0.0,长宁路1018号龙之梦购物中心2楼
火星国际网球培训(富城路),运动健身,网球场,0.0,0.0,0.0,富城路55号
