谷田稻香(来福士店),美食,小吃快餐,7.2,7.3,7.5,长宁路1123号来福士广场东区6层21F
置美医疗美容诊所,医疗健康,整形,0.0,0.0,0.0,长宁路1191号长宁来福士广场西区03层02号
流行演唱培训中心,学习培训,职业技术,0.0,0.0,0.0,安昌桥头南天大厦6楼(安昌桥头农行楼上)
金茂时尚生活中心(世纪大道店),购物,综合商场,7.1,7.2,7.2,世纪大道88号金茂大厦裙楼内
色廊Colour Corridor染发专家,丽人,美发,9.4,9.4,9.4,汇川路99号新时空广场5楼514室
东亚银行(长宁路支行),生活服务,银行,0.0,0.0,0.0,长宁路1196号
京汇粹(龙之梦购物中心店),美食,其他,8.3,8.6,7.9,长宁路1018号龙之梦购物中心8楼
云海肴云南菜(正大广场店),美食,云南菜,8.2,8.6,8.6,陆家嘴西路168号正大广场6F
长宁中学,学习培训,教育院校,7.2,7.2,7.2,长宁路1302弄9号
得一大药房(龙之梦购物中心店),购物,药店,6.8,6.7,6.7,长宁路1018号龙之梦购物中心B2楼
普华永道中天会计师事务所,生活服务,公司企业,0.0,0.0,0.0,陆家嘴环路1318号星展银行大厦6楼
丰和日丽(正大广场店),美食,本帮江浙菜,7.7,8.0,7.1,陆家嘴西路168号正大广场6楼
青古植艺,休闲娱乐,更多休闲娱乐,0.0,0.0,0.0,正大广场2楼中庭
Christian Louboutin(国金中心店...,购物,更多购物场所,8.0,8.0,7.6,上海浦东新区世纪大道8号IFC国金中心商场L1-32号店
Forest Rose Afternoon Tea,休闲娱乐,咖啡厅,7.5,8.9,8.2,长宁路890号玫瑰坊1F-72
City Outlets 城市奥特莱斯,购物,品牌折扣店,6.7,6.4,6.4,长宁路1018号龙之梦9楼
中山公园高尔夫初学培训(仙霞店),运动健身,高尔夫场,0.0,0.0,0.0,长宁路1201号
sony数码(陆家嘴店),购物,数码产品,5.8,7.7,5.8,陆家嘴西路168号正大广场4楼12号铺
平安银行(上海分行营业部),生活服务,银行,0.0,0.0,0.0,陆家嘴环路1333号中国平安金融大厦
汽车帮电 配汽车钥匙,爱车,维修保养,0.0,0.0,0.0,陆家嘴东园路
图文数码写真,生活服务,快照/冲印,0.0,0.0,0.0,陆家嘴东路
天马座花艺(中山公园店),购物,花店,7.0,7.0,7.0,定西路1525号
adidas kids(长宁龙之梦店),购物,亲子购物,0.0,0.0,0.0,长宁路1018号龙之梦购物中心6楼
新时空众理酒店式公寓(中山公园...,酒店,三星级/舒适型,7.9,7.2,7.3,汇川路99号8楼809室
瑜舍连锁瑜伽(中山公园店),丽人,瑜伽,0.0,0.0,0.0,长宁路988号花园大厦
一兆韦德健身(来福士旗舰店),运动健身,健身中心,0.0,0.0,0.0,长宁路1191号来福士广场西区4楼03*09号
熊本熊酷ma萌授权专卖店(正大广...,购物,更多购物场所,8.6,8.1,8.4,陆家嘴西路168号正大广场四楼玩具反斗城门口
国际会议中心会展公司,生活服务,公司企业,0.0,0.0,0.0,丰和路
陆小白专业脱毛中心(中山公园店),丽人,美甲美睫,8.1,7.8,8.0,长宁路988号花园大厦704B室
罗森(汇川路店),购物,超市/便利店,7.2,7.1,6.8,汇川路91号
金牌外婆家(长宁来福士店),美食,本帮江浙菜,7.0,7.7,8.1,长宁路1123号长宁来福士东区6楼606-607
采果园(正大店),购物,水果生鲜,6.8,6.9,6.9,陆家嘴西路168号正大广场B2-25
准星房产(长宁路店),生活服务,房屋地产,0.0,0.0,0.0,长宁路1156号附近
morganfield's摩根菲(长宁来福士...,美食,西餐,0.0,0.0,0.0,长宁路1189号来福士广场
圣廷棋牌会所,休闲娱乐,棋牌室,0.0,0.0,0.0,汇川路99号新时空国际商务广场3楼4楼
龙之梦万丽酒店青餐厅,美食,自助餐,7.7,9.0,8.7,长宁路1018号龙之梦万丽酒店26楼
稚爱宝贝母婴家政(定西路店),生活服务,家政,0.0,0.0,0.0,定西路1277号204室
百岁山,购物,食品茶酒,0.0,0.0,0.0,长宁路1018号龙之梦购物中心B1层
AJIYA(中山公园店),美食,日本菜,8.4,8.1,8.7,长宁路999号兆丰广场B1楼吉家美食荟F106室
Swatch(长宁龙之梦店),购物,珠宝饰品,7.3,7.1,7.1,长宁路1018号龙之梦购物中心2楼2019号铺
一笼小确幸(正大广场店),美食,粤菜,7.9,8.7,8.1,陆家嘴西路168号正大广场7楼7F05B
陶艺,休闲娱乐,DIY手工坊,0.0,0.0,0.0,长宁路780号
港开茶餐厅,美食,粤菜,6.6,6.9,7.0,世纪大道55号世纪天桥2楼-2室
火星羽毛球游泳网球篮球乒乓球(...,运动健身,羽毛球馆,0.0,0.0,0.0,世纪大道50号
平安银行(定西路支行),生活服务,银行,0.0,0.0,0.0,定西路1299号
中山公园龙之梦停车场,爱车,停车场,0.0,0.0,0.0,长宁路1028号
劳合社保险中国有限公司,生活服务,公司企业,0.0,0.0,0.0,陆家嘴环路1233号汇亚大厦33楼
租户餐厅,美食,其他,7.5,7.4,7.4,中银大厦6楼
诤友车社,学习培训,职业技术,0.0,0.0,0.0,长宁路1055号
慕轩律师事务所,生活服务,更多生活服务,0.0,0.0,0.0,华阳路街道长宁路1027号兆丰广场2306室
台湾市集(正大广场店),美食,台湾菜,7.0,7.0,7.1,陆家嘴西路168号正大广场B2楼食代馆内
美丽田园(金茂店),丽人,美容/SPA,9.2,9.3,9.3,世纪大道88号金茂大厦裙楼4N01-4N05室
HUAWEI(龙之梦购物中心店),购物,数码产品,7.5,7.5,7.5,长宁路1018号龙之梦购物中心B1楼
粤1525,美食,粤菜,8.2,8.9,8.0,定西路1525号2楼
City Dance舞蹈会所(中山公园旗...,运动健身,舞蹈,0.0,0.0,0.0,长宁路888弄15号兆丰嘉园会所
知音琴行(旗舰店),学习培训,音乐培训,7.0,7.1,7.1,长宁路1200号贝多芬广场B座3楼
OSIM(正大广场店),购物,家居建材,7.3,7.4,7.4,陆家嘴西路168号（近东方明珠）正大广场5楼
捷辉汽车美容养护中心,爱车,维修保养,0.0,0.0,0.0,凯旋路439号
mamonde(屈臣氏长宁龙之梦店),丽人,化妆品,6.4,6.4,6.4,长宁路1018号3楼屈臣氏柜台
希多蜜眼镜(正大店),购物,眼镜店,9.2,9.2,9.2,正大广场5楼（麦当劳对面）
麦茂专业催乳产后康复中心,丽人,产后塑形,8.8,8.8,8.8,汇川路99号
中国工商银行(正大广场支行),生活服务,银行,0.0,0.0,0.0,陆家嘴西路168号正大广场B1楼09-10号铺
富临轩(正大广场店),美食,粤菜,7.9,7.9,7.6,陆家嘴西路168号（近东方明珠）正大广场4楼
中国银行24小时自助银行,生活服务,银行,0.0,0.0,0.0,长宁路1170号
Coterie(国金中心商场店),购物,眼镜店,7.7,7.7,6.8,世纪大道8号国金中心商场LG2层
晨光生活馆(正大广场店),购物,更多购物场所,7.6,7.7,7.5,陆家嘴西路168号正大广场大众书局内
暗恋桃花源,美食,本帮江浙菜,7.1,7.4,7.1,龙之梦7楼
一代眼镜(正大店),购物,眼镜店,7.7,7.8,7.8,陆家嘴西路168号正大广场B2楼
鲜米仙经典饮料路之站,美食,其他,6.9,6.9,6.9,陆家嘴环路1396号
星蓉川食酒肆,美食,川菜,0.0,0.0,0.0,龙之梦购物中心7楼
海马体照相馆,生活服务,快照/冲印,0.0,0.0,0.0,长宁路1139号长宁来福士尚雅馆2楼
炉边情谈(正大广场店),美食,烧烤,0.0,0.0,0.0,陆家嘴西路168号（近东方明珠）正大广场6楼
夫子林,学习培训,美术培训,7.4,7.4,7.2,长宁路1158号A座206室
上海家荣酒店公寓,酒店,公寓式酒店,8.0,7.8,7.8,汇川路99号1612室
香港日置名媛美容瘦身(正大广场...,丽人,瘦身纤体,8.4,8.2,8.3,陆家嘴西路168号正大广场7楼09铺位
江边城外烤全鱼(龙之梦购物中心...,美食,川菜,8.6,8.5,8.6,长宁路1018号龙之梦购物中心6楼
范北社区卫生服务站,生活服务,医院,0.0,0.0,0.0,凯旋路141号
小马路商场,购物,综合商场,7.1,7.1,7.4,长宁路820号
蒙奇奇,购物,更多购物场所,7.6,7.6,7.6,长宁路1018号中山公园龙之梦
大众道路救援补轮胎搭电处,生活服务,更多生活服务,0.0,0.0,0.0,世纪大道8号
刘娟美甲沙龙(长宁来福士店),丽人,纹绣,9.2,9.3,9.3,长宁路1123号来福士广场06层34/42号
Wen handcraft studio(玫瑰坊店),休闲娱乐,DIY手工坊,0.0,0.0,0.0,长宁路890号玫瑰坊2楼2F-03
虎丸烧肉(玫瑰坊店),美食,日本菜,9.0,8.0,7.9,长宁路890号玫瑰坊2楼
西贝莜面村(上海正大广场店),美食,西北菜,8.8,8.8,9.0,陆家嘴西路168号正大广场8层
EF英孚教育成人英语培训中心(中...,学习培训,外语培训,5.2,5.4,5.4,长宁路1018号龙之梦购物中心8楼
MIXXO(龙之梦购物中心店),购物,服饰鞋包,7.5,7.7,7.0,长宁路1018号龙之梦购物中心2楼
Body Soul 舞蹈工作室(中山公园...,丽人,舞蹈,0.0,0.0,0.0,长宁路855号亨通国际15楼B室
上海光力国际公寓酒店,酒店,经济型,6.2,6.4,6.0,汇川路99号新时空商务广场3楼321室
飞利浦(龙之梦购物中心店),购物,家居建材,6.6,6.9,6.9,长宁路1018号龙之梦购物中心B1楼
星巴克(长宁来福士t3店),美食,咖啡厅,7.7,7.6,7.5,长宁路1139号长宁来福士1楼
柏斯艺术专修学校(中山公园分部),学习培训,音乐培训,6.8,6.8,6.9,凯旋路200号1楼
新时空晨梦国际酒店公寓(中山公...,酒店,公寓式酒店,7.0,7.6,7.3,汇川路99号1408室
致远裱画配框中心(中山公园店),生活服务,更多生活服务,0.0,0.0,0.0,长宁路三泾北宅244号
潜水艇体验馆,周边游,展馆展览,0.0,0.0,0.0,滨江大道2789号
2号售票口,生活服务,售票点,0.0,0.0,0.0,丰和路
Miss Taipei,美食,台湾菜,8.4,8.6,8.6,长宁路1123号长宁来福士东区6楼36号
上海陆家嘴ifc住宅酒店,酒店,经济型,6.8,6.8,6.8,世纪大道8号
后Queen line高端半永久定妆中心...,丽人,美甲美睫,9.4,9.3,9.4,长宁路969弄兆丰花园1807室2号线7号口
海派spa线下体验中心,休闲娱乐,足疗按摩,0.0,0.0,0.0,汇川路99号新时空国际商务广场10楼1007室
金茂87层九重天,休闲娱乐,咖啡厅,7.7,8.6,8.2,陆家嘴世纪大道88号
百事窗帘墙纸安装制作中心(窗帘...,购物,家居建材,0.0,0.0,0.0,长宁路1018号龙之梦购物中心
华尔街英语(正大广场中心),学习培训,外语培训,9.0,9.1,9.1,浦东新区陆家嘴西路168号正大广场6楼61店铺
众信旅游(龙之梦购物中心店),生活服务,旅行社,0.0,0.0,0.0,长宁路1018号龙之梦购物中心B2楼
Fresh(正大广场店),购物,化妆品,7.9,7.9,7.3,陆家嘴西路168号正大广场一楼01FL34
奥斯汀鲜花(上海浦东陆家嘴店),生活服务,花店,7.6,7.7,7.6,世纪大道8号
叶家花卉(陆家嘴站),购物,花店,7.2,7.0,7.0,世纪大道145号
WeCan Fitness Club,运动健身,健身中心,0.0,0.0,0.0,长宁路1188弄圣约翰名邸五号楼会所二楼
美容院(正大广场店),医疗健康,整形,0.0,0.0,0.0,陆家嘴西路168号正大广场1楼
正大广场,购物,综合商场,7.7,7.7,7.2,陆家嘴西路168号
美式眼镜(龙之梦购物中心店),购物,眼镜店,8.0,8.1,8.1,长宁路1018号龙之梦购物中心B2楼
叶家花卉(叶家花卉龙之梦店),生活服务,花店,7.8,7.8,7.8,长宁路1018号
Coffee Passionate(国金中心商场...,美食,咖啡厅,7.2,7.4,7.6,世纪大道8号国金中心商场LG2层
中国工商银行(中山公园站支行),生活服务,银行,0.0,0.0,0.0,地铁2号线中山公园站2-101
BeBeyond,学习培训,更多教育培训,6.7,6.5,7.0,安化路492号易园B幢301室
梧桐楼,生活服务,小区,0.0,0.0,0.0,长宁路1277弄24号
Dr.NCD(正大广场店),丽人,美容/SPA,9.2,9.2,9.2,陆家嘴西路168号（近东方明珠）正大广场2楼
厚继续博士口腔诊所,医疗健康,齿科,8.5,8.7,8.5,路1158号贝多芬广场A座201室
New Balance,购物,运动户外,7.1,6.9,6.8,陆家嘴西路168号正大广场4楼18B-19号铺
罗莱生活luolai(兆丰广场店),购物,家居建材,0.0,0.0,0.0,长宁路1027号兆丰广场1层
星巴克(正大店),美食,咖啡厅,7.6,7.5,7.5,陆家嘴西路168号3F
appleme培训中心,丽人,舞蹈,0.0,0.0,0.0,世纪大道8号国际金融中心1208室
华燕置业发展有限公司,生活服务,房屋地产,0.0,0.0,0.0,长宁路1027号兆丰广场1901室-3室
得一大药房(龙之梦购物中心店),医疗健康,药店,6.8,6.7,6.7,长宁路1018号龙之梦购物中心B2楼
安娜美甲美睫沙龙(中山公园店),丽人,美甲美睫,9.2,9.2,9.2,长宁路889号
麦隆咖啡Mellower Coffee(正大广...,美食,咖啡厅,8.1,8.4,8.2,陆家嘴西路168号，正大广场1楼
壹晴持久定妆美甲美睫沙龙,丽人,纹绣,9.5,9.4,9.5,汇川路99号新时空国际商务广场1914室
上海新时空嘉廷酒店(原新时空瑞...,酒店,商务酒店,7.3,7.6,7.0,汇川路99号新时空国际广场2楼
COACH(龙之梦购物中心店),购物,更多购物场所,0.0,0.0,0.0,长宁路1018号龙之梦购物中心1楼
魔魔岛密室(中山公园店),休闲娱乐,密室,0.0,0.0,0.0,长宁路988号花园大厦6楼606室
李珃.塑颜工作室(小马路商场店),丽人,纹绣,8.5,8.3,8.7,长宁路820号小马路商场B1层
Vital Tea 源素茶(长宁龙之梦店),美食,咖啡厅,8.0,8.4,8.3,长宁路1018号龙之梦购物中心1F-1055
三泾庙,周边游,景点,8.4,8.4,8.4,长宁路三泾北宅244号
安东鸡(正大广场店),美食,韩国料理,7.1,7.7,7.2,陆家嘴西路168号（近东方明珠）正大广场8楼
汉宫白领食堂(银城中路店),美食,本帮江浙菜,7.2,6.7,6.6,银城中路200号中银大厦6楼
春雅洗衣生活馆(定西路店),生活服务,衣物/皮具洗护,0.0,0.0,0.0,定西路1317号底层
可心美颜（良い美容サロン）(中...,丽人,瘦身纤体,9.3,9.2,9.3,汇川路99号501（地铁2号线7号或8号出口30米.3.4号线2号出口30米）
IL COLPO(国金中心商场店),丽人,美发,9.3,9.3,9.3,世纪大道8号上海国金中心商场4楼19-29号商铺
全家便利店(川汇路店),购物,超市/便利店,7.2,7.0,6.9,汇川路10弄2号
锦江旅游(龙之梦购物中心店),生活服务,旅行社,0.0,0.0,0.0,长宁路1018号龙之梦购物中心5楼
贵族花艺,购物,花店,9.1,9.1,9.1,浦东陆家嘴西路168号正大广场B2中厅面包新语对面
瑾萱花屋(中山公园店),购物,花店,7.9,7.9,7.9,长宁路1018号
新世界教育(中山公园校区),学习培训,升学辅导,7.4,7.4,7.2,长宁路855号亨通国际大厦5楼
马奴拉改衣,生活服务,裁缝改衣,0.0,0.0,0.0,陆家嘴西路168号正大广场B1
中国电信电话亭,生活服务,通信营业厅,0.0,0.0,0.0,长宁路824号
星巴克(国金中心店),休闲娱乐,咖啡厅,7.6,7.4,7.3,世纪大道8号上海国金中心D座商场裙房B2层LG2-29室
崛起,生活服务,网站,0.0,0.0,0.0,世纪大道1号
Down Under,休闲娱乐,茶馆,0.0,0.0,0.0,陆家嘴西路168号正大广场8楼
花音集(龙之梦店),购物,更多购物场所,7.8,7.9,7.8,长宁路1018号龙之梦购物中心B1F
家乐福(龙之梦购物中心店),购物,超市/便利店,6.7,6.3,5.9,长宁路1018号龙之梦购物中心B2楼
上海龙之梦万丽酒店,酒店,商务酒店,8.2,8.3,8.1,长宁路1018号 ，近汇川路
東田造型(正大店),丽人,美发,9.0,9.2,9.1,陆家嘴西路168号正大广场7楼06AB室
逃牛岭Runaway Cow Bistro,美食,西餐,7.9,9.2,8.4,长宁路890号玫瑰坊1楼2号中山公园西侧
翡翠拉面小笼包(正大广场店),美食,小吃快餐,7.2,7.5,7.5,陆家嘴西路168号（近东方明珠）正大广场8楼
diptyque(国金中心店),丽人,化妆品,7.8,7.8,7.8,上海ifc国金中心地下二层1010APOTHECARY
苏宁电器(长宁路店),购物,家居建材,7.1,6.8,6.5,长宁路999号多媒体生活广场内
INDITEX,生活服务,公司企业,0.0,0.0,0.0,凯旋路369号龙之梦雅仕大厦
海关大楼,生活服务,商务楼,0.0,0.0,0.0,陆家嘴环西路153号
欢天喜地旅行社(陆家嘴分部),生活服务,旅行社,0.0,0.0,0.0,世纪大道55号
优元素,购物,食品茶酒,7.2,7.0,7.2,陆家嘴西路168号正大广场B1楼
ajidou阿吉豆(中山公园店),购物,珠宝饰品,7.5,7.5,7.7,长宁路1018号龙之梦购物中心B2楼
乐智小天地(龙之梦购物中心店),购物,亲子购物,0.0,0.0,0.0,长宁路1018号龙之梦购物中心6楼
鼎泰丰(正大广场店),美食,小吃快餐,7.3,7.6,7.5,陆家嘴西路168号正大广场3楼24号铺
伊蒂小屋(长宁龙之梦店),丽人,化妆品,7.5,7.4,7.0,长宁路1018号长宁龙之梦购物中心
天行健心理咨询中心,学习培训,更多教育培训,0.0,0.0,0.0,长宁路969号兆丰公园3007
唛哆港式烧腊(正大广场店),美食,粤菜,6.8,6.7,6.6,陆家嘴西路168号正大广场B2楼
G.Flower鲜花港(中山公园店),生活服务,花店,9.2,9.1,9.2,汇川路464号
菓寨(正大广场店),美食,其他,0.0,0.0,0.0,陆家嘴西路168号正大广场5楼
星巴克(龙之梦2店),休闲娱乐,咖啡厅,7.5,7.2,7.4,长宁路1018号龙之梦购物中心1楼1073号铺
阳光花卉(花花世界),购物,花店,0.0,0.0,0.0,汇川路66号
东方明珠电视塔+豪华浦江游船门...,酒店,经济型,0.0,0.0,0.0,陆家嘴环路1390号
牛卡vr,休闲娱乐,游乐游艺,0.0,0.0,0.0,陆家嘴西路168号正大广场8层
中星国际旅行社有限公司,生活服务,旅行社,0.0,0.0,0.0,丰和路1号港务大厦东楼2层3210
茂昌眼镜(定西路店),购物,眼镜店,7.9,8.1,7.8,定西路1305号三联商厦1楼
truelove挚爱鲜花,购物,花店,0.0,0.0,0.0,陆家嘴环路1333号（(近东方明珠)）
蜜丝芭莉&丹邸好士(IFC国金中心...,丽人,瘦身纤体,7.6,7.8,7.9,世纪大道8号上海国金中心D座2层L2-17-2＆3 shanghai IFC，NO.8 Century Avenue building D
电信企业宽带贝多芬广场受理点,生活服务,通信营业厅,0.0,0.0,0.0,长宁路1200号
Taco Bell 塔可贝尔(陆家嘴店),美食,西餐,8.9,9.0,9.0,世纪大道55号东方浮庭1F-1室
高尔夫练习场成人教学,休闲娱乐,更多休闲娱乐,0.0,0.0,0.0,陆家嘴环路
明洞本家韩国碳烤(正大店),美食,韩国料理,7.3,7.3,7.3,陆家嘴西路168号正大广场6楼
巴黎春天新世界酒店浓咖啡,美食,自助餐,6.9,7.7,7.4,定西路1555号酒店2楼
GUCCI,购物,化妆品,0.0,0.0,0.0,长宁路1018号龙之梦购物中心F1
小帅重庆面(兆丰广场店),美食,面馆,7.0,6.8,7.1,长宁路1027号兆丰广场B1层
赵小姐不等位(龙之梦购物中心店),美食,其他,7.2,8.2,8.0,长宁路1018号龙之梦购物中心7楼
绿地未来馆,生活服务,房屋地产,0.0,0.0,0.0,长宁路
麻辣香锅达人,美食,川菜,6.8,6.8,6.7,陆家嘴还路1400号
新石器烤肉(长宁龙之梦店),美食,烧烤,7.8,7.9,7.8,长宁路1018号龙之梦大厦7楼蓝中庭
s·box(正大广场店),购物,办公/文化用品,0.0,0.0,0.0,陆家嘴西路168号正大广场L3层3F77
Abercrombie&Fitch(国金中心店),购物,服饰鞋包,8.6,8.7,8.6,世纪大道8号国金中心商场LG1层
故乡屋(正大广场店),美食,韩国料理,6.5,6.7,6.6,陆家嘴西路168号正大广场B2楼大食代美食广场内
巴黎春天(中山公园店),购物,综合商场,6.7,6.4,6.4,长宁路823号
utc行家(龙之梦购物中心店),购物,综合商场,7.2,7.2,7.6,长宁路1018号龙之梦购物中心4楼
滋味轩(玫瑰坊店),美食,粤菜,6.0,5.7,5.4,长宁路890号玫瑰坊B1楼
上海国旅,生活服务,旅行社,0.0,0.0,0.0,世纪大道1号
小辉哥火锅(中山公园龙之梦购物...,美食,火锅,8.5,8.5,8.3,长宁路1018号中山公园龙之梦购物中心7楼
小拱猪,美食,贵州菜,6.9,6.9,6.9,延安东路隧道与陆家嘴西路交叉口南50米
避风塘(长宁龙之梦店),美食,粤菜,7.1,7.1,6.4,长宁路1018号龙之梦购物中心8楼
Body Soul 舞蹈工作室(中山公园...,运动健身,舞蹈,0.0,0.0,0.0,长宁路855号亨通国际15楼B室
galette(正大广场店),休闲娱乐,更多休闲娱乐,0.0,0.0,0.0,陆家嘴西路168号
FOREST ROSE森林玫瑰(玫瑰坊店),购物,更多购物场所,9.2,9.3,9.3,长宁路890号玫瑰坊1楼
花样年华,购物,花店,7.1,7.1,7.1,长宁路890号玫瑰坊3楼
翠华餐厅(长宁来福士店),美食,粤菜,0.0,0.0,0.0,长宁路1139号东区B106
WIN HOUSE(正大广场店),美食,西餐,8.5,8.6,8.6,正大广场陆家嘴西路168号1楼GF27
华为体验店,购物,数码产品,7.7,7.5,7.7,凯旋路来福士一楼
yoyo沙龙,丽人,美发,9.1,9.1,9.1,陆家嘴滨江大道2727号国际会议中心内东方滨江大酒店1号电梯直达九楼
忠良开锁换锁(龙之梦店),生活服务,开锁,0.0,0.0,0.0,长宁路1018号龙之梦广场地下两层B2家乐福寄包柜旁
上海浦东正大广场Basketball Jor...,购物,运动户外,7.9,8.1,7.8,陆家嘴西路168号正大广场5楼07-08A
瑞贝思专业脱毛沙龙(中山公园店),丽人,纹绣,9.4,9.4,9.5,汇川路99号新时空国际商务广场29楼2901室
美的(龙之梦购物中心店),购物,家居建材,0.0,0.0,0.0,长宁路1018号龙之梦购物中心B1楼
曼都发型(正大广场店),丽人,美发,8.6,8.9,8.7,陆家嘴西路168号正大广场B1西区18C号
北岛民宿,酒店,更多酒店住宿,0.0,0.0,0.0,长宁路城宁花苑小区
进口红酒批发零售,购物,食品茶酒,7.8,7.5,7.8,定西路1564弄1-5
绊Kizuha,休闲娱乐,酒吧,0.0,0.0,0.0,安化路565号
赤坂小亭(长宁龙之梦店),美食,烧烤,7.9,7.9,8.2,长宁路1018号龙之梦购物中心7楼7204-7205号
东方明珠城市广场,生活服务,商务楼,0.0,0.0,0.0,世纪大道1号东方明珠城市广场8号门
Ilnido,休闲娱乐,酒吧,0.0,0.0,0.0,长宁路890号玫瑰坊1层50号
星米休闲餐厅(上海浦东正大广场...,美食,火锅,7.4,7.4,7.3,陆家嘴西路168号正大广场b2层1A-01
上海国金汇服务式公寓,酒店,五星级/豪华型,9.2,8.7,8.8,世纪大道8号
年利达律师事务所(上海代表处),生活服务,更多生活服务,0.0,0.0,0.0,陆家嘴环路166号未来资产大厦29/30层
邦德物流有限公司,生活服务,物流快递,0.0,0.0,0.0,陆家嘴滨江大道
华阳路街道图书馆,休闲娱乐,文化艺术,0.0,0.0,0.0,安化路500号
舒施雅SPA养生会所,休闲娱乐,中医养生,0.0,0.0,0.0,银城中路200号中银大厦6楼(近延安路隧道浦东出口处）地铁2号线陆家嘴站3号出口直达
欧舒丹(国金中心商场店),丽人,化妆品,8.4,8.5,7.3,世纪大道8号国金中心商场LG2层
正大星美牛卡,休闲娱乐,游乐游艺,0.0,0.0,0.0,陆家嘴西路168号正大广场8层
快网网球俱乐部(陆家嘴店),运动健身,网球场,0.0,0.0,0.0,富城路33号香格里拉酒店4楼
苏宁积分机,生活服务,更多生活服务,0.0,0.0,0.0,上海长宁区长宁路1027号兆丰广场1层
乐鱼国际风尚露营,休闲娱乐,更多休闲娱乐,0.0,0.0,0.0,德必易园B座101室
Master piece,购物,食品茶酒,0.0,0.0,0.0,世纪大道8号上海国金中心商场3层
家华造型艺术专修学校(兆丰广场...,学习培训,职业技术,6.8,6.7,6.8,长宁路1027号兆丰广场3层
Mr&MrsFitness琦健身(兆丰广场店...,运动健身,健身中心,0.0,0.0,0.0,长宁路1027号兆丰广场6层
自鱿人(长宁龙之梦),购物,食品茶酒,7.1,6.8,6.5,长宁路1018号龙之梦购物B1
名甲物语(浦东丽思卡尔顿),丽人,美甲美睫,8.9,9.0,8.8,浦东丽思卡尔顿酒店55楼,陆家嘴世纪大道8号
PARKER(龙之梦购物中心店),购物,更多购物场所,7.3,7.2,7.3,长宁路1018号龙之梦购物中心1楼
朝日日语(中山公园中心),学习培训,外语培训,9.1,9.1,9.0,长宁路855号亨通国际大厦18楼
70后饭吧(长宁龙之梦店),美食,川菜,7.9,8.2,7.9,长宁路1018号中山公园龙之梦7楼
花音集(国金购物中心店),生活服务,花店,7.7,7.6,7.7,陆家嘴国金购物中心LG2
NBA(龙之梦购物中心店),购物,运动户外,7.5,6.1,6.1,长宁路1018号龙之梦购物中心5楼
彩花束(陆家嘴西路正大广场店),生活服务,花店,9.3,9.3,9.3,陆家嘴西路168号正大广场B2楼超市中门入口右侧
诗泥SPA(正大广场店),丽人,美容/SPA,9.0,9.0,8.9,陆家嘴西路168号（近东方明珠）正大广场7楼
city's super(国金中心商场店),购物,超市/便利店,8.6,8.7,8.2,世纪大道8号国金中心商场LG2层
水货SEAHOOD(长宁龙之梦店),美食,其他,7.6,8.4,8.3,长宁路1018号龙之梦购物中心梦6楼
CLARINS skin spa(国金中心商场...,丽人,美容/SPA,7.6,7.6,7.6,世纪大道8号国金中心商场LG1层
上海巴黎春天新世界酒店,酒店,五星级/豪华型,7.8,7.9,7.7,定西路1555号
醇品会明珠酒窖,学习培训,兴趣生活,0.0,0.0,0.0,丰和路1号港务大厦西裙房地下二层
LAWSON罗森(中银大厦店),购物,超市/便利店,6.9,6.7,6.6,银城中路200号1F
松沢屋,美食,日本菜,8.7,8.5,8.6,凯旋路166号2号楼2楼
SEPHORA(龙之梦购物中心店),丽人,化妆品,6.8,7.3,5.9,长宁路1018号龙之梦购物中心1楼
后Queen line高端半永久定妆中心...,丽人,纹绣,9.4,9.3,9.4,长宁路969弄兆丰花园1807室2号线7号口
Columbia(国金店),购物,运动户外,7.0,7.2,6.7,世纪大道8号国际金融中心B1楼
曹诺-亚洲钢管舞(上海总店),运动健身,舞蹈,0.0,0.0,0.0,凯旋路166号-1楼中山公园龙之梦汇川路大门
艾维庭美容纤体SPA(中山公园店),丽人,瘦身纤体,7.9,8.0,8.0,汇川路88号凯欣豪园B1楼
新东方前途出国浦东中心,生活服务,更多生活服务,0.0,0.0,0.0,银城中路200号30层
屈臣氏(正大广场店),购物,超市/便利店,6.8,6.4,6.2,陆家嘴西路168号（近东方明珠）正大广场B1楼
GU极优(龙之梦购物中心店),购物,服饰鞋包,8.9,9.0,9.0,长宁路1018号龙之梦购物中心B2楼
均和集团,学习培训,升学辅导,0.0,0.0,0.0,陆家嘴环路166号未来资产大厦27层c-d座
DSV,生活服务,公司企业,0.0,0.0,0.0,凯旋路369号龙之梦雅仕大厦
adidas(正大店),购物,运动户外,7.5,7.4,6.5,陆家嘴西路168号正大广场1楼1106室
辣翻天川菜馆,美食,川菜,0.0,0.0,0.0,陆家嘴环路1033号
星空琴行(龙之梦购物中心店),学习培训,音乐培训,7.0,7.1,7.1,长宁路1018号龙之梦购物中心5楼
ORIGINS(龙之梦购物中心店),购物,化妆品,7.9,8.0,7.8,长宁路1018号龙之梦购物中心1楼
猫家美甲美睫纹绣沙龙,丽人,纹绣,9.2,9.2,9.3,汇川路99号新时空广场5楼502室
办卡学习高尔夫球,运动健身,高尔夫场,0.0,0.0,0.0,陆家嘴东园路
